{
  "schema": "orch.addon/2",
  "name": "publish",
  "version": "0.1.0",
  "title": "Publish",
  "entry": {
    "cmd": [
      "orch-publish-addon",
      "serve"
    ]
  },
  "capabilities": [
    "network"
  ],
  "agents_md": "Publish: share ticket files by link (orch publish prepare) or an app/page/form you built (orch app prepare REF FILE.. --name N --kind app --access company). A person signs and sends it."
}
